<?xml version="1.0" encoding="UTF-8"?>
<!DOCTYPE Inventario SYSTEM "inventario.dtd">
<?xml-stylesheet type="text/xsl" href="equipment.xsl"?>

<Inventario>
    <Equipamiento añoCompra="2016" proveedor="ProveedorE">
        <Tipo>Switch</Tipo>
        <Modelo>HP ProCurve 2843</Modelo>
        <Ano>2016</Ano>
        <Caracteristicas>48 Puertos 100Mbps Gestionable</Caracteristicas>
        <Image path="../img/network/1.png"/>
    </Equipamiento>
    <Equipamiento añoCompra="2020" proveedor="ProveedorF">
        <Tipo>Router</Tipo>
        <Modelo>Cisco RouterX</Modelo>
        <Ano>2020</Ano>
        <Caracteristicas>4 Puertos Gigabit, WiFi 6</Caracteristicas>
        <Image path="../img/network/2.png"/>
    </Equipamiento>
    <Equipamiento añoCompra="2018" proveedor="ProveedorL">
        <Tipo>Switch</Tipo>
        <Modelo>Cisco Catalyst 2960</Modelo>
        <Ano>2018</Ano>
        <Caracteristicas>24 Puertos Gigabit</Caracteristicas>
        <Image path="../img/network/3.png"/>
    </Equipamiento>
    <Equipamiento añoCompra="2019" proveedor="ProveedorM">
        <Tipo>Router</Tipo>
        <Modelo>Juniper SRX240</Modelo>
        <Ano>2019</Ano>
        <Caracteristicas>8 Puertos Gigabit, VPN</Caracteristicas>
        <Image path="../img/network/4.png"/>
    </Equipamiento>
    <Equipamiento añoCompra="2019" proveedor="ProveedorM">
        <Tipo>Router</Tipo>
        <Modelo>Movistar Mitrastar GPT-2541GNAC</Modelo>
        <Ano>2022</Ano>
        <Caracteristicas>WiFi 5, 4 Ports Gigabit Ethernet</Caracteristicas>
        <Image path="../img/network/5.png"/>
    </Equipamiento>
</Inventario>