<?xml version="1.0" encoding="UTF-8"?>
<!DOCTYPE Inventario SYSTEM "inventario.dtd">
<?xml-stylesheet type="text/xsl" href="other.xsl"?>

<Inventario>
    <Impresora añoCompra="2018" proveedor="ProveedorI">
        <Modelo>Brother ColorFUL 1369</Modelo>
        <Ano>2018</Ano>
        <Caracteristicas>Impresión a color, 600dpi, WiFi</Caracteristicas>
        <Image path="../img/other/1.png"/>
    </Impresora>
    <Proyector añoCompra="2019" proveedor="ProveedorJ">
        <Modelo>Optoma 94375FHD</Modelo>
        <Ano>2019</Ano>
        <Caracteristicas>Resolución 1080p, 3000 lúmenes</Caracteristicas>
        <Image path="../img/other/4.png"/>
    </Proyector>
    <Scanner añoCompra="2020" proveedor="ProveedorK">
        <Modelo>Epson ProScan 420</Modelo>
        <Ano>2020</Ano>
        <Caracteristicas>Escaneo a doble cara, 1200dpi</Caracteristicas>
        <Image path="../img/other/7.png"/>
    </Scanner>
    <Impresora añoCompra="2021" proveedor="ProveedorL">
        <Modelo>HP LaserJet Pro M402dn</Modelo>
        <Ano>2021</Ano>
        <Caracteristicas>Impresión láser, 1200dpi, Ethernet</Caracteristicas>
        <Image path="../img/other/2.png"/>
    </Impresora>
    <Proyector añoCompra="2022" proveedor="ProveedorM">
        <Modelo>Epson Home Cinema 2150</Modelo>
        <Ano>2022</Ano>
        <Caracteristicas>Resolución 1080p, 2500 lúmenes, Wireless</Caracteristicas>
        <Image path="../img/other/5.png"/>
    </Proyector>
    <Scanner añoCompra="2023" proveedor="ProveedorN">
        <Modelo>Canon ImageFORMULA DR-C225 II</Modelo>
        <Ano>2023</Ano>
        <Caracteristicas>Escaneo automático de documentos, 600dpi</Caracteristicas>
        <Image path="../img/other/8.png"/>
    </Scanner>
    <Impresora añoCompra="2024" proveedor="ProveedorO">
        <Modelo>Brother HL-L2320D</Modelo>
        <Ano>2024</Ano>
        <Caracteristicas>Impresión monocromática, 2400dpi, USB</Caracteristicas>
        <Image path="../img/other/3.png"/>
    </Impresora>
    <Proyector añoCompra="2025" proveedor="ProveedorP">
        <Modelo>BenQ MH530FHD</Modelo>
        <Ano>2025</Ano>
        <Caracteristicas>Resolución 1080p, 3300 lúmenes</Caracteristicas>
        <Image path="../img/other/6.png"/>
    </Proyector>
    <Scanner añoCompra="2026" proveedor="ProveedorQ">
        <Modelo>Fujitsu ScanSnap iX1500</Modelo>
        <Ano>2026</Ano>
        <Caracteristicas>Escaneo a color, 600dpi, WiFi</Caracteristicas>
        <Image path="../img/other/9.png"/>
    </Scanner>
</Inventario>
