<?xml version="1.0" encoding="UTF-8"?>
<!DOCTYPE Inventario SYSTEM "inventario.dtd">
<?xml-stylesheet type="text/xsl" href="server.xsl"?>

<Inventario>
    <Servidor añoCompra="2017" proveedor="ProveedorN" ip="192.168.1.100">
        <Modelo>Dell PowerEdge R740</Modelo>
        <Ano>2017</Ano>
		 <ComponentesBasicos>
            <CPU>Intel Xeon</CPU>
            <RAM>32GB DDR4 ECC</RAM>
            <DiscoDuro>512GB SSD + 10TB HDD</DiscoDuro>
            <TarjetaGrafica>Intel HD Graphics 4600</TarjetaGrafica>
        </ComponentesBasicos>
        <Image path="../img/server/1.png"/>
    </Servidor>
    <Servidor añoCompra="2018" proveedor="ProveedorM" ip="192.168.1.101">
        <Modelo>HP ProLiant DL380 Gen10</Modelo>
        <Ano>2018</Ano>
		 <ComponentesBasicos>
            <CPU>Intel Xeon</CPU>
            <RAM>64GB DDR4 ECC</RAM>
            <DiscoDuro>1TB SSD + 8TB HDD</DiscoDuro>
            <TarjetaGrafica>NVIDIA Quadro RTX 8000</TarjetaGrafica>
        </ComponentesBasicos>
        <Image path="../img/server/2.png"/>
    </Servidor>
    <Servidor añoCompra="2019" proveedor="ProveedorO" ip="192.168.1.102">
        <Modelo>IBM System x3650 M5</Modelo>
        <Ano>2019</Ano>
		 <ComponentesBasicos>
            <CPU>Intel Xeon</CPU>
            <RAM>128GB DDR4 ECC</RAM>
            <DiscoDuro>2TB SSD + 12TB HDD</DiscoDuro>
            <TarjetaGrafica>AMD Radeon Pro WX 9100</TarjetaGrafica>
        </ComponentesBasicos>
        <Image path="../img/server/3.png"/>
    </Servidor>
    <Servidor añoCompra="2020" proveedor="ProveedorP" ip="192.168.1.103">
        <Modelo>Lenovo ThinkSystem SR650</Modelo>
        <Ano>2020</Ano>
		 <ComponentesBasicos>
            <CPU>Intel Xeon</CPU>
            <RAM>256GB DDR4 ECC</RAM>
            <DiscoDuro>4TB SSD + 16TB HDD</DiscoDuro>
            <TarjetaGrafica>AMD Radeon Pro WX 8200</TarjetaGrafica>
        </ComponentesBasicos>
        <Image path="../img/server/4.png"/>
    </Servidor>
    <Servidor añoCompra="2021" proveedor="ProveedorQ" ip="192.168.1.104">
        <Modelo>Cisco UCS C240 M5</Modelo>
        <Ano>2021</Ano>
		 <ComponentesBasicos>
            <CPU>Intel Xeon</CPU>
            <RAM>512GB DDR4 ECC</RAM>
            <DiscoDuro>8TB SSD + 20TB HDD</DiscoDuro>
            <TarjetaGrafica>NVIDIA Tesla V100</TarjetaGrafica>
        </ComponentesBasicos>
        <Image path="../img/server/5.png"/>
    </Servidor>
    <Servidor añoCompra="2022" proveedor="ProveedorR" ip="192.168.1.105">
        <Modelo>Supermicro SuperServer 10210U-TNR4T+</Modelo>
        <Ano>2022</Ano>
		 <ComponentesBasicos>
            <CPU>Intel Xeon</CPU>
            <RAM>1024GB DDR4 ECC</RAM>
            <DiscoDuro>16TB SSD + 24TB HDD</DiscoDuro>
            <TarjetaGrafica>AMD Radeon Pro WX 9100</TarjetaGrafica>
        </ComponentesBasicos>
        <Image path="../img/server/6.png"/>
    </Servidor>
</Inventario>
